Направление,Наименование источника,Ссылка,Комментарии,Категория,Тип источника,Страна,Список
7.Общие,BuiltWith,https://builtwith.com/,"Технологии, используемые сайтами.",Каталоги софта/техстеки,Website,Глобал,Расширенный список
7.Общие,Wappalyzer,https://www.wappalyzer.com/,Распознавание стеков на сайтах.,Каталоги софта/техстеки,Website,Глобал,Расширенный список
7.Общие,AlternativeTo,https://alternativeto.net/,Альтернативы софту по задачам.,Каталоги софта/техстеки,Website,Глобал,Расширенный список
7.Общие,OpenHub,https://www.openhub.net/,Каталог open-source проектов и метрики.,Каталоги софта/техстеки,Website,Глобал,Расширенный список
7.Общие,Gartner Peer Insights,http://www.gartner.com/peer-insights/,Платформа с отзывами реальных пользователей корпоративного ПО и услуг.,Голос клиента и отзывы,Website,Глобал,Расширенный список
7.Общие,Capterra,http://www.capterra.com,Крупный онлайн-маркетплейс с отзывами на программное обеспечение для бизнеса.,Голос клиента и отзывы,Website,Глобал,Расширенный список
7.Общие,G2,http://www.g2.com,Платформа для peer-to-peer обзоров бизнес-решений.,Голос клиента и отзывы,Website,Глобал,Расширенный список
7.Общие,IRecommend.ru,http://irecommend.ru,Сайт-отзовик на потребительские товары и услуги.,Голос клиента и отзывы,Website,Глобал,Расширенный список
7.Общие,Отзовик,http://otzovik.com,Сайт-отзовик на потребительские товары и услуги.,Голос клиента и отзывы,Website,Глобал,Расширенный список
7.Общие,Brandwatch,http://www.brandwatch.com,"Платформа для анализа потребительского мнения в социальных сетях, блогах и на форумах.",Голос клиента и отзывы,Website,Глобал,Расширенный список
7.Общие,Brand24,http://brand24.com,Инструмент для мониторинга упоминаний бренда в реальном времени.,Голос клиента и отзывы,Website,Глобал,Расширенный список
7.Общие,Sprout Social,http://sproutsocial.com,Платформа для управления социальными сетями с аналитическими и слушающими модулями.,Голос клиента и отзывы,Website,Глобал,Расширенный список
7.Общие,Hootsuite,http://www.hootsuite.com,Платформа для управления социальными сетями с аналитическими модулями.,Голос клиента и отзывы,Website,Глобал,Расширенный список
7.Общие,Socialbakers (Emplifi),http://emplifi.io,Платформа для управления социальными сетями с аналитическими модулями.,Голос клиента и отзывы,Website,Глобал,Расширенный список
7.Общие,Meltwater,http://www.meltwater.com,Комплексное решение для мониторинга СМИ и социальных сетей.,Голос клиента и отзывы,Website,Глобал,Расширенный список
7.Общие,AnswerThePublic,http://answerthepublic.com,Инструмент для визуализации поисковых запросов и вопросов пользователей в Google.,Голос клиента и отзывы,Website,Глобал,Расширенный список
7.Общие,SSRN,https://www.ssrn.com/,"Препринты по экономике, менеджменту.",Академические и патентные исследования,Website,Глобал,Расширенный список
7.Общие,NBER,https://www.nber.org/,Исследования по экономике и рынкам.,Академические и патентные исследования,Website,Глобал,Расширенный список
7.Общие,arXiv,https://arxiv.org/,Препринты по CS/AI/математике.,Академические и патентные исследования,Website,Глобал,Расширенный список
7.Общие,Pew Research Center,https://www.pewresearch.org/,"Опросы, соцтренды, поведение пользователей.",Академические и патентные исследования,Website,Глобал,Расширенный список
7.Общие,Ipsos Global Trends,https://www.ipsos.com/en/global-trends,Глобальные тренды и потребительские инсайты.,Академические и патентные исследования,Website,Глобал,Расширенный список
7.Общие,YouGov,https://today.yougov.com/data,Исследования общественного мнения и брэндов.,Академические и патентные исследования,Website,Глобал,Расширенный список
7.Общие,Gallup World Poll,https://www.gallup.com,"Мировые опросы, благополучие, работа.",Академические и патентные исследования,Website,Глобал,Расширенный список
7.Общие,Statista,https://www.statista.com/,Агрегатор статистики по рынкам (freemium).,Академические и патентные исследования,Website,Глобал,Расширенный список
7.Общие,Google Scholar,http://scholar.google.com,"Поисковая система по научной литературе: статьи, диссертации, книги.",Академические и патентные исследования,Website,Глобал,Расширенный список
7.Общие,BASE,http://www.base-search.net,Поисковая система по академическим ресурсам в открытом доступе.,Академические и патентные исследования,Website,Глобал,Расширенный список
7.Общие,Dimensions,http://www.dimensions.ai,"Исследовательская база данных, связывающая публикации, гранты, патенты и клинические испытания.",Академические и патентные исследования,Website,Глобал,Расширенный список
7.Общие,ResearchGate,http://www.researchgate.net,Социальная сеть для ученых и исследователей для обмена статьями.,Академические и патентные исследования,Website,Глобал,Расширенный список
7.Общие,Scilit,http://www.scilit.net,Комплексный агрегатор научных публикаций от издательства MDPI.,Академические и патентные исследования,Website,Глобал,Расширенный список
7.Общие,Google Patents,http://patents.google.com,Поисковая система по миллионам патентов и заявок со всего мира.,Академические и патентные исследования,Website,Глобал,Расширенный список
7.Общие,PATENTSCOPE (WIPO),http://www.wipo.int/patentscope,"Глобальная база данных ВОИС, обеспечивающая доступ к международным патентным заявкам.",Академические и патентные исследования,Website,Глобал,Расширенный список
7.Общие,Espacenet,http://worldwide.espacenet.com,Бесплатный инструмент поиска патентов от Европейского патентного ведомства (EPO).,Академические и патентные исследования,Website,Глобал,Расширенный список
7.Общие,Информационно-поисковая система ФИПС,http://fips.ru,"Поиск по российским патентам на изобретения, полезные модели и другим объектам интеллектуальной собственности.",Академические и патентные исследования,Website,Глобал,Расширенный список
7.Общие,Meta Ad Library,https://www.facebook.com/ads/library/,Поиск креативов и политической рекламы Meta.,Рекламные библиотеки/креативы,Website,Глобал,Расширенный список
7.Общие,TikTok Creative Center,https://www.tiktok.com/business/creativecenter/,"Тренды, топ-креативы и аудио.",Рекламные библиотеки/креативы,Website,Глобал,Расширенный список
7.Общие,Google Ads Transparency Center,https://adstransparency.google.com/,Объявления в Google,Рекламные библиотеки/креативы,Website,Глобал,Расширенный список
7.Общие,X Ads Transparency,https://transparency.twitter.com/,Публичные отчёты и политика рекламы X/Twitter.,Рекламные библиотеки/креативы,Website,Глобал,Расширенный список
7.Общие,Snap Political Ads Library,https://publicfiles.snap.com/,Библиотека политрекламы Snapchat.,Рекламные библиотеки/креативы,Website,Глобал,Расширенный список
7.Общие,Moat Creative Gallery,https://moat.com/creative,Примеры дисплей-креативов и брендов.,Рекламные библиотеки/креативы,Website,Глобал,Расширенный список
7.Общие,Priceva,http://priceva.com,Сервис для мониторинга цен конкурентов и автоматизации ценообразования.,Инструменты для анализа цен,Website,Глобал,Расширенный список
7.Общие,Competera,http://competera.net,"AI-платформа для ценообразования, основанного на спросе, для ритейлеров.",Инструменты для анализа цен,Website,Глобал,Расширенный список
7.Общие,Price2Spy,http://www.price2spy.com,Инструмент для мониторинга и сравнения цен конкурентов для e-commerce.,Инструменты для анализа цен,Website,Глобал,Расширенный список
7.Общие,Prisync,http://prisync.com,Программное обеспечение для отслеживания цен конкурентов для компаний электронной коммерции всех размеров.,Инструменты для анализа цен,Website,Глобал,Расширенный список
7.Общие,Metacommerce,http://metacommerce.ru,"SaaS-сервис для мониторинга ассортимента, цен и анализа конкурентов в онлайн и офлайн ритейле.",Инструменты для анализа цен,Website,Глобал,Расширенный список
7.Общие,Gartner,http://www.gartner.com,"Ведущая мировая исследовательская компания, известная инструментами Magic Quadrant и Hype Cycle.",Рыночные исследования и отчеты,Website,Глобал,Расширенный список
7.Общие,Forrester,http://www.forrester.com,"Влиятельная аналитическая фирма, известная инструментом The Forrester Wave™.",Рыночные исследования и отчеты,Website,Глобал,Расширенный список
7.Общие,IDC,http://www.idc.com,"Специализируется на данных о размерах рынка, прогнозах и долях поставщиков в IT.",Рыночные исследования и отчеты,Website,Глобал,Расширенный список
7.Общие,MarketResearch.com,http://www.marketresearch.com,Агрегатор отчетов от сотен исследовательских компаний.,Рыночные исследования и отчеты,Website,Глобал,Расширенный список
7.Общие,Statista,http://www.statista.com,"Онлайн-платформа для сбора, визуализации и предоставления статистических данных.",Рыночные исследования и отчеты,Website,Глобал,Расширенный список
7.Общие,CB Insights,http://www.cbinsights.com,"Платформа для анализа данных о технологиях, стартапах и венчурном капитале.",Рыночные исследования и отчеты,Website,Глобал,Расширенный список
7.Общие,Nielsen,http://www.nielsen.com,"Аналитика потребительского поведения, ритейла и медиа.",Рыночные исследования и отчеты,Website,Глобал,Расширенный список
7.Общие,Ipsos,http://www.ipsos.com,"Глобальная исследовательская компания, специализирующаяся на изучении потребительского поведения и общества.",Рыночные исследования и отчеты,Website,Глобал,Расширенный список
7.Общие,Потребительское поведение; факты и тренды,https://t.me/c_behavior,Аналитический канал Дмитрия Фролова о потребительских и маркетинговых трендах.,Рыночные исследования и отчеты,Telegram,Россия,Расширенный список
7.Общие,Globalook: анализ зарубежных рынков,https://t.me/globalook,"Канал об исследованиях международных рынков: полезные ссылки, инструменты, кейсы и новости. С любовью к картам и визуализации данных.",Рыночные исследования и отчеты,Telegram,Глобал,Расширенный список
7.Общие,Nielsen Norman Group (NN/g),https://www.nngroup.com/,"Исследования и best practices UX, регулярные обзоры трендов и методов.",Дизайн/UX тренды (издания и дайджесты),Website,Глобал,Расширенный список
7.Общие,Smashing Magazine,https://www.smashingmagazine.com/,"Глубокие статьи и практики по фронтенду, UX и доступности.",Дизайн/UX тренды (издания и дайджесты),Website,Глобал,Расширенный список
7.Общие,UX Collective (uxdesign.cc),https://uxdesign.cc/,"Крупнейшая публикация про UX на Medium: тренды, процессы, кейсы.",Дизайн/UX тренды (издания и дайджесты),Website,Глобал,Расширенный список
7.Общие,Sidebar,https://sidebar.io/,Ежедневная рассылка «5 дизайн-ссылок в день»: свежие тренды и чтение.,Дизайн/UX тренды (издания и дайджесты),Website,Глобал,Расширенный список
7.Общие,Web Designer News,https://www.webdesignernews.com/,"Агрегатор новостей по веб-дизайну/UX, ежедневные подборки.",Дизайн/UX тренды (издания и дайджесты),Website,Глобал,Расширенный список
7.Общие,designboom,https://www.designboom.com/,Медиа о дизайне и визуальной культуре; вдохновение и тренды.,Дизайн/UX тренды (издания и дайджесты),Website,Глобал,Расширенный список
7.Общие,AIGA Eye on Design,https://eyeondesign.aiga.org/,"Публикации AIGA на стыке графдиза, брендинга и цифровых трендов.",Дизайн/UX тренды (издания и дайджесты),Website,Глобал,Расширенный список
7.Общие,Today in Design,https://www.todayin.design/,"Дайджест новостей для дизайнеров: события, ресурсы, тренды.",Дизайн/UX тренды (издания и дайджесты),Website,Глобал,Расширенный список
7.Общие,Awwwards,https://www.awwwards.com/,"Витрина лучших сайтов мира, срез визуальных веб-трендов.",Галереи/шоукейсы (веб),Website,Глобал,Расширенный список
7.Общие,Webflow Showcase,https://webflow.com/made-in-webflow/showcase,Тысячи #MadeInWebflow проектов; удобно фильтровать по анимациям/нишам.,Галереи/шоукейсы (веб),Website,Глобал,Расширенный список
7.Общие,Framer Gallery,https://www.framer.com/gallery/,Галерея сайтов на Framer; свежие паттерны анимаций и верстки.,Галереи/шоукейсы (веб),Website,Глобал,Расширенный список
7.Общие,Land-book,https://land-book.com/,"Курированная галерея веб-сайтов, часто — современные лендинги.",Галереи/шоукейсы (веб),Website,Глобал,Расширенный список
7.Общие,Lapa Ninja,https://www.lapa.ninja/,>7k лендингов с 2015 года; быстрый срез по CTA/героям/секциям.,Галереи/шоукейсы (веб),Website,Глобал,Расширенный список
7.Общие,One Page Love,https://onepagelove.com/,Одностраничные сайты: тренды в структуре и копирайте.,Галереи/шоукейсы (веб),Website,Глобал,Расширенный список
7.Общие,Dribbble (Popular/Trending),https://dribbble.com/shots/popular,"Визуальные тренды UI/иллюстраций, быстрый «термометр» стилистики.",Галереи/шоукейсы (веб),Website,Глобал,Расширенный список
7.Общие,Behance (Interaction),https://www.behance.net/,Кураторские подборки по Interaction/UX; тренды по интерактиву.,Галереи/шоукейсы (веб),Website,Глобал,Расширенный список
7.Общие,Mobbin,https://mobbin.com/,"Огромная база реальных экранов и флоу iOS/Android/Web, обновляется еженедельно.",Паттерны/флоу/мобильные,Website,Глобал,Расширенный список
7.Общие,Page Flows,https://pageflows.com/,"Видеофлоу и скриншоты ключевых сценариев (онбординг, чек-аут и др.).",Паттерны/флоу/мобильные,Website,Глобал,Расширенный список
7.Общие,UI Sources,https://uisources.com/,">800 видео-интеракций и >2,400 скриншотов, разложенных по паттернам.",Паттерны/флоу/мобильные,Website,Глобал,Расширенный список
7.Общие,GoodUX (Appcues),https://goodux.appcues.com/,"Библиотека «Really Good UX»: примеры онбординга, туров, empty states.",Паттерны/флоу/мобильные,Website,Глобал,Расширенный список
7.Общие,Pttrns,https://www.pttrns.com/,"Каталог мобильных UI-паттернов, ориентир по iOS/Android.",Паттерны/флоу/мобильные,Website,Глобал,Расширенный список
7.Общие,UI-Patterns.com,https://ui-patterns.com/,Справочник повторяющихся UI-решений и поведенческих «карточек».,Паттерны/флоу/мобильные,Website,Глобал,Расширенный список
7.Общие,Collect UI,https://collectui.com/,Ежедневно курируемые UI-работы по компонентам/темам.,Паттерны/флоу/мобильные,Website,Глобал,Расширенный список
7.Общие,patterns.dev,https://www.patterns.dev/,Современные паттерны компонент/рендеринга/перфоманса для веб-приложений.,Паттерны/флоу/мобильные,Website,Глобал,Расширенный список
7.Общие,web.dev/patterns,https://web.dev/patterns,Паттерны интерфейсов и layout’ов на современных CSS-API.,Паттерны/флоу/мобильные,Website,Глобал,Расширенный список
7.Общие,Really Good Emails,https://reallygoodemails.com/,"Тренды e-mail UX/UI: >12k писем, категории, «популярное сейчас».",Паттерны/флоу/мобильные,Website,Глобал,Расширенный список
7.Общие,The World Bank Data,http://data.worldbank.org,"Глобальные данные о развитии, включая демографию, экономические показатели и отраслевую статистику.",Макроэкономические и демографические данные,Website,Глобал,Расширенный список
7.Общие,IMF Data,http://data.imf.org,"Данные по макроэкономике и финансовым рынкам: кредитование, обменные курсы, государственные финансы.",Макроэкономические и демографические данные,Website,Глобал,Расширенный список
7.Общие,UNdata,http://data.un.org,"Агрегированная статистика от агентств ООН по демографии, промышленности и социальным показателям.",Макроэкономические и демографические данные,Website,Глобал,Расширенный список
7.Общие,OECD Data,http://data.oecd.org,Подробные данные и аналитика по развитым странам-членам ОЭСР.,Макроэкономические и демографические данные,Website,СНГ,Расширенный список
7.Общие,U.S. Census Bureau,http://data.census.gov,Основной источник демографических и экономических данных по США.,Макроэкономические и демографические данные,Website,США,Расширенный список
7.Общие,Data.gov,http://www.data.gov,Центральное хранилище открытых данных правительства США.,Макроэкономические и демографические данные,Website,США,Расширенный список
7.Общие,Census Business Builder,http://www.census.gov/data/data-tools/cbb.html,Инструмент для анализа потребительских расходов и бизнес-статистики на географическом уровне в США.,Макроэкономические и демографические данные,Website,США,Расширенный список
7.Общие,Bureau of Labor Statistics (BLS),http://www.bls.gov,"Данные по занятости, инфляции (CPI) и уровню заработной платы в США.",Макроэкономические и демографические данные,Website,США,Расширенный список
7.Общие,Bureau of Economic Analysis (BEA),http://www.bea.gov,"Официальный источник макроэкономической и отраслевой статистики США, включая ВВП.",Макроэкономические и демографические данные,Website,США,Расширенный список
